{
  "schema_version": 1,
  "dataset_id": "a1_grammar_coverage_ownership",
  "version": 1,
  "inputs": [
    {
      "path": "data/derived/egp-all-levels.json",
      "sha256": "c8b87795774e1938125d2bd105a962a97c887712e1fae8bcbfdfa5e3ec9536b3"
    },
    {
      "path": "data/derived/gse-grammar-all.json",
      "sha256": "ae13883e6408054c060604f11d1d77a100e8bf90954b8fc9fbe6e08d2a27ee3b"
    },
    {
      "path": "data/reviewed/grammar-family-strands-v1.json",
      "sha256": "00a83dbe2818a1aec6f668fbf26182da5cfef6528b1c7e6afbbb3f7e915aec7e"
    },
    {
      "path": "data/reviewed/a1-reconciliation-worklist-v1.json",
      "sha256": "b61e6d565003c5cee170db8c3660f9b96159894e39f928fe4fd71cd7075ae983"
    },
    {
      "path": "data/reviewed/a1-outcome-level-fit-review-v1.json",
      "sha256": "28c0e4fca70c99f2517314f3b2d866eb8f66a5c5500e7833030b6dc7c74defc4"
    },
    {
      "path": "data/reviewed/a1-ability-coverage-overlap-audit-v1.json",
      "sha256": "9d986a4fe493926aaec9723333a478b0d8c877d708d57c9fc46af49542b7798d"
    }
  ],
  "policy": {
    "source_role": "EGP and GSE Grammar are evidence inventories, not automatic lesson or mastery checklists.",
    "course_item_role": "The controlled items define exact A1 forms, meanings, limits, contexts, and fresh-task mastery evidence.",
    "ownership_status": "Candidate owners are reconciliation contexts and may move intact when candidates merge or the final sequence changes.",
    "variety_policy": "Internationally intelligible core English is taught; have is the course default while BrE have got is registered as valid.",
    "assessment_policy": "Grammar is assessed through meaning-preserving use in fresh communicative tasks, not rule naming or isolated recall alone."
  },
  "course_items": [
    {
      "item_id": "grammar.be_affirmative",
      "title": "Present be: affirmative",
      "control_status": "productive_core",
      "exact_forms": [
        "I am/I'm",
        "you/we/they are/'re",
        "he/she/it is/'s",
        "subject + be + name, age, nationality, job, location, noun phrase, or adjective"
      ],
      "meaning_use": "Identify and describe people, things, states, and locations in the present.",
      "introduction_owner_ids": [
        "lesson_candidate.understand_spoken_personal_introductions",
        "lesson_candidate.give_short_self_introduction"
      ],
      "recycle_owner_ids": [
        "lesson_candidate.write_short_personal_profile",
        "lesson_candidate.introduce_another_person",
        "lesson_candidate.describe_a_family_or_known_person"
      ],
      "mastery_evidence": "Produce accurate subject-be agreement in fresh identity and description prompts.",
      "not_yet": "Past be and complex complements wait for later control.",
      "decision_status": "accepted_for_a1_reconciliation",
      "source_evidence": {
        "source_count": 11,
        "egp_feature_ids": [
          "1741163706530x753542801715210100",
          "1741163712047x409239658002596100",
          "1741163713867x970460151516622800",
          "1741163715288x539616242661052000",
          "1741163715608x123988758899529200"
        ],
        "gse_grammar_record_ids": [
          "gse.grammar.2023.p07.002",
          "gse.grammar.2023.p07.005",
          "gse.grammar.2023.p07.006",
          "gse.grammar.2023.p07.008",
          "gse.grammar.2023.p08.001",
          "gse.grammar.2023.p09.003"
        ]
      }
    },
    {
      "item_id": "grammar.be_negative",
      "title": "Present be: negative",
      "control_status": "productive_core",
      "exact_forms": [
        "I am not/I'm not",
        "you/we/they are not/aren't",
        "he/she/it is not/isn't"
      ],
      "meaning_use": "Correct or deny a present identity, state, description, or location.",
      "introduction_owner_ids": [
        "lesson_candidate.write_short_personal_profile"
      ],
      "recycle_owner_ids": [
        "lesson_candidate.describe_a_family_or_known_person",
        "lesson_candidate.describe_a_familiar_object_orally",
        "lesson_candidate.describe_a_simple_problem_to_a_health_professional"
      ],
      "mastery_evidence": "Correct a false detail using the matching negative form without a model.",
      "not_yet": "No emphatic, tag, or contrastive negative system at A1.",
      "decision_status": "accepted_for_a1_reconciliation",
      "source_evidence": {
        "source_count": 4,
        "egp_feature_ids": [
          "1741163708329x778951051617750700",
          "1741163716067x824562184770361200",
          "1741163715288x539616242661052000"
        ],
        "gse_grammar_record_ids": [
          "gse.grammar.2023.p08.001"
        ]
      }
    },
    {
      "item_id": "grammar.be_questions",
      "title": "Present be: questions and short answers",
      "control_status": "productive_core",
      "exact_forms": [
        "Am I ...?",
        "Are you/we/they ...?",
        "Is he/she/it ...?",
        "wh-word + am/is/are + subject?",
        "Yes, subject + am/is/are; No, subject + am not/isn't/aren't"
      ],
      "meaning_use": "Ask and answer direct questions about identity, state, description, and location.",
      "introduction_owner_ids": [
        "lesson_candidate.exchange_personal_details_orally"
      ],
      "recycle_owner_ids": [
        "lesson_candidate.exchange_information_about_family_and_friends",
        "lesson_candidate.exchange_visible_object_information",
        "lesson_candidate.exchange_basic_information_about_a_home"
      ],
      "mastery_evidence": "Complete a fresh information gap with correct be-question order and relevant short answers.",
      "not_yet": "Embedded questions and question tags wait for later levels.",
      "decision_status": "accepted_for_a1_reconciliation",
      "source_evidence": {
        "source_count": 5,
        "egp_feature_ids": [
          "1741163708336x928067678664856700",
          "1741163713867x150062658595893500"
        ],
        "gse_grammar_record_ids": [
          "gse.grammar.2023.p07.011",
          "gse.grammar.2023.p07.012",
          "gse.grammar.2023.p08.005"
        ]
      }
    },
    {
      "item_id": "grammar.present_simple_affirmative",
      "title": "Present simple: affirmative",
      "control_status": "productive_core",
      "exact_forms": [
        "I/you/we/they + base verb",
        "he/she/it + verb-s/-es",
        "limited irregular forms: have/has, do/does, go/goes"
      ],
      "meaning_use": "State present facts, routines, likes, and familiar repeated actions.",
      "introduction_owner_ids": [
        "lesson_candidate.write_short_personal_profile",
        "lesson_candidate.introduce_another_person"
      ],
      "recycle_owner_ids": [
        "lesson_candidate.give_a_simple_leisure_profile",
        "lesson_candidate.describe_a_simple_everyday_routine",
        "lesson_candidate.write_simple_life_and_routine_sentences"
      ],
      "mastery_evidence": "Write or say fresh facts about self and another person with controlled third-person agreement.",
      "not_yet": "Subtle stative/dynamic distinctions and broader irregular morphology wait.",
      "decision_status": "accepted_for_a1_reconciliation",
      "source_evidence": {
        "source_count": 9,
        "egp_feature_ids": [
          "1741163713626x414037782388433340",
          "1741163713626x486355013779909760",
          "1741163713626x606524312014730500",
          "1741163715288x929829619225120500"
        ],
        "gse_grammar_record_ids": [
          "gse.grammar.2023.p07.003",
          "gse.grammar.2023.p08.007",
          "gse.grammar.2023.p08.010",
          "gse.grammar.2023.p09.004",
          "gse.grammar.2023.p09.010"
        ]
      }
    },
    {
      "item_id": "grammar.present_simple_negative",
      "title": "Present simple: negative",
      "control_status": "productive_core",
      "exact_forms": [
        "I/you/we/they do not/don't + base verb",
        "he/she/it does not/doesn't + base verb"
      ],
      "meaning_use": "State that a fact, preference, possession, or routine is not true.",
      "introduction_owner_ids": [
        "lesson_candidate.exchange_information_about_family_and_friends"
      ],
      "recycle_owner_ids": [
        "lesson_candidate.write_a_short_hobbies_and_likes_post",
        "lesson_candidate.state_a_basic_food_or_drink_preference"
      ],
      "mastery_evidence": "Correct false routine and preference statements using do/does plus the base verb.",
      "not_yet": "Negative adverbials and emphatic do wait for later levels.",
      "decision_status": "accepted_for_a1_reconciliation",
      "source_evidence": {
        "source_count": 5,
        "egp_feature_ids": [
          "1741163708329x894844343465365000",
          "1741163716067x101148462288360720",
          "1741163713626x335670389512142900"
        ],
        "gse_grammar_record_ids": [
          "gse.grammar.2023.p08.008",
          "gse.grammar.2023.p09.004"
        ]
      }
    },
    {
      "item_id": "grammar.present_simple_questions",
      "title": "Present simple: questions and short answers",
      "control_status": "productive_core",
      "exact_forms": [
        "Do + I/you/we/they + base verb?",
        "Does + he/she/it + base verb?",
        "wh-word + do/does + subject + base verb?",
        "Yes, subject + do/does; No, subject + don't/doesn't"
      ],
      "meaning_use": "Exchange facts, routines, possessions, likes, and wants.",
      "introduction_owner_ids": [
        "lesson_candidate.exchange_information_about_family_and_friends"
      ],
      "recycle_owner_ids": [
        "lesson_candidate.exchange_routine_and_preference_information",
        "lesson_candidate.exchange_basic_information_about_a_home",
        "lesson_candidate.exchange_information_about_an_immediate_need"
      ],
      "mastery_evidence": "Ask and answer fresh yes/no and wh- questions without retaining -s on the main verb after does.",